{
  "title": "Request for Clarification",
  "project": "Procurement Demonstration",
  "recipient": "Supplier Representative",
  "reference": "DEMO-001",
  "questions": [
    {
      "item": "Technical specification",
      "question": "Please confirm the proposed equipment capacity and provide the supporting document reference."
    },
    {
      "item": "Delivery schedule",
      "question": "Please clarify whether the quoted delivery period includes installation and acceptance testing."
    }
  ]
}
